{
  "challenge_id": "CHAL_001",
  "claim_id": "CLAIM_001",
  "claim_text": "Patch X improves validation reliability over baseline.",
  "challenge_type": "regression",
  "target": {
    "system": "uLab",
    "module": "uwrap-validate"
  },
  "inputs": {
    "artifacts": [
      "demo/fixtures/baseline_results.json",
      "demo/fixtures/patched_results.json"
    ],
    "params": {
      "baseline_version": "v0.9.0",
      "patched_version": "v0.9.1",
      "test_suite": "uwrap-validate-core"
    }
  },
  "success_criteria": {
    "metric": "validation_pass_rate",
    "threshold": 0.95
  },
  "created_at": "2026-04-01T16:26:05.126Z",
  "source": "uMirror",
  "status": "PROPOSED"
}
